{
  "$schema": "../schemas/tool.v2.schema.json",
  "v": "2.0",
  "type": "tool",
  "id": "mikrotik",

  "name": "MikroTik RouterOS Tools",
  "description": "Network management tools for MikroTik RouterOS devices. Includes router discovery, health monitoring, DHCP management, firewall rules, VPN status, and diagnostic tools with plain English explanations.",
  "category": "infrastructure",
  "subcategory": "network",
  "provider": "mikrotik",
  "version": "1.0.0",

  "risk_level": "medium",
  "sandbox_profile": "standard",
  "requires_license": "mikrotik-routeros",

  "tools": [
    {
      "id": "mikrotik.discovery.scan",
      "name": "Scan Network",
      "description": "Discover MikroTik routers on the network using CDP/MNDP neighbor discovery",
      "aeeIntent": "quox.noc.mikrotik.discovery.scan",
      "aoclClassification": { "layer": 1, "risk": "LOW", "autonomy": "FULL" },
      "accessLevel": "specialists+",
      "defconLevel": "GREEN",
      "requiresApproval": false,
      "parameters": {
        "subnet": {
          "type": "string",
          "required": false,
          "description": "CIDR subnet to scan (e.g., '10.0.0.0/24')"
        }
      },
      "returns": {
        "type": "object",
        "properties": {
          "routers": { "type": "array" },
          "count": { "type": "number" }
        }
      },
      "instructions": {
        "summary": "Discovers MikroTik routers using neighbor discovery protocols",
        "when_to_use": [
          "Finding routers on network",
          "Building initial inventory",
          "User asks 'what routers do I have?'"
        ],
        "when_not_to_use": [
          "Already have complete router list"
        ]
      }
    },
    {
      "id": "mikrotik.discovery.inventory",
      "name": "Get Inventory",
      "description": "Get complete inventory of all routers and connected devices",
      "aeeIntent": "quox.noc.mikrotik.discovery.inventory",
      "aoclClassification": { "layer": 1, "risk": "LOW", "autonomy": "FULL" },
      "accessLevel": "specialists+",
      "defconLevel": "GREEN",
      "requiresApproval": false,
      "parameters": {
        "router_id": {
          "type": "string",
          "required": false,
          "description": "Filter by specific router ID"
        },
        "include_devices": {
          "type": "boolean",
          "required": false,
          "default": true,
          "description": "Include connected devices"
        }
      },
      "returns": {
        "type": "object",
        "properties": {
          "routers": { "type": "array" },
          "devices": { "type": "array" },
          "total": { "type": "number" }
        }
      },
      "instructions": {
        "summary": "Get full inventory of routers and devices",
        "when_to_use": [
          "User asks 'what devices are on my network?'",
          "Need to see all connected clients"
        ]
      }
    },
    {
      "id": "mikrotik.monitoring.health",
      "name": "Check Health",
      "description": "Get router health including CPU, memory, temperature, and uptime with health score",
      "aeeIntent": "quox.noc.mikrotik.health.query",
      "aoclClassification": { "layer": 1, "risk": "LOW", "autonomy": "FULL" },
      "accessLevel": "specialists+",
      "defconLevel": "GREEN",
      "requiresApproval": false,
      "parameters": {
        "router_id": {
          "type": "string",
          "required": true,
          "description": "Router ID to check"
        }
      },
      "returns": {
        "type": "object",
        "properties": {
          "health": { "type": "object" },
          "score": { "type": "number" },
          "issues": { "type": "array" }
        }
      },
      "instructions": {
        "summary": "Check router health status and resource usage",
        "when_to_use": [
          "User asks 'is my router healthy?'",
          "User wants to check CPU/memory usage",
          "Troubleshooting performance issues"
        ]
      }
    },
    {
      "id": "mikrotik.monitoring.interfaces",
      "name": "List Interfaces",
      "description": "Get interface statistics including errors, utilization, and link status",
      "aeeIntent": "quox.noc.mikrotik.interfaces.list",
      "aoclClassification": { "layer": 1, "risk": "LOW", "autonomy": "FULL" },
      "accessLevel": "specialists+",
      "defconLevel": "GREEN",
      "requiresApproval": false,
      "parameters": {
        "router_id": {
          "type": "string",
          "required": true,
          "description": "Router ID"
        },
        "interface": {
          "type": "string",
          "required": false,
          "description": "Specific interface name (optional)"
        }
      },
      "returns": {
        "type": "object",
        "properties": {
          "interfaces": { "type": "array" },
          "total": { "type": "number" }
        }
      },
      "instructions": {
        "summary": "Get interface status and statistics",
        "when_to_use": [
          "User asks about network ports",
          "Checking for interface errors",
          "Verifying link status"
        ]
      }
    },
    {
      "id": "mikrotik.monitoring.traffic",
      "name": "Monitor Traffic",
      "description": "Get real-time bandwidth usage per interface",
      "aeeIntent": "quox.noc.mikrotik.traffic.query",
      "aoclClassification": { "layer": 1, "risk": "LOW", "autonomy": "FULL" },
      "accessLevel": "specialists+",
      "defconLevel": "GREEN",
      "requiresApproval": false,
      "parameters": {
        "router_id": {
          "type": "string",
          "required": true,
          "description": "Router ID"
        },
        "interface": {
          "type": "string",
          "required": false,
          "description": "Specific interface (optional)"
        }
      },
      "returns": {
        "type": "object",
        "properties": {
          "traffic": { "type": "array" }
        }
      },
      "instructions": {
        "summary": "Get real-time traffic statistics",
        "when_to_use": [
          "User asks 'how much bandwidth am I using?'",
          "Monitoring network activity"
        ]
      }
    },
    {
      "id": "mikrotik.dhcp.leases",
      "name": "List DHCP Leases",
      "description": "List all DHCP leases with device identification (vendor lookup)",
      "aeeIntent": "quox.noc.mikrotik.dhcp.leases.list",
      "aoclClassification": { "layer": 1, "risk": "LOW", "autonomy": "FULL" },
      "accessLevel": "specialists+",
      "defconLevel": "GREEN",
      "requiresApproval": false,
      "parameters": {
        "router_id": {
          "type": "string",
          "required": true,
          "description": "Router ID"
        }
      },
      "returns": {
        "type": "object",
        "properties": {
          "leases": { "type": "array" },
          "total": { "type": "number" }
        }
      },
      "instructions": {
        "summary": "List all DHCP leases and identify devices",
        "when_to_use": [
          "User asks 'what devices have IP addresses?'",
          "Looking for a specific device by hostname or MAC"
        ]
      }
    },
    {
      "id": "mikrotik.dhcp.reserve",
      "name": "Reserve IP Address",
      "description": "Create a static DHCP reservation for a device so it always gets the same IP",
      "aeeIntent": "quox.noc.mikrotik.dhcp.reserve",
      "aoclClassification": { "layer": 3, "risk": "MEDIUM", "autonomy": "SUPERVISED" },
      "accessLevel": "managers+",
      "defconLevel": "AMBER",
      "requiresApproval": true,
      "parameters": {
        "router_id": {
          "type": "string",
          "required": true,
          "description": "Router ID"
        },
        "mac_address": {
          "type": "string",
          "required": true,
          "description": "MAC address of device"
        },
        "address": {
          "type": "string",
          "required": true,
          "description": "IP address to reserve"
        },
        "comment": {
          "type": "string",
          "required": false,
          "description": "Description for the reservation"
        }
      },
      "returns": {
        "type": "object",
        "properties": {
          "lease": { "type": "object" },
          "success": { "type": "boolean" },
          "preview": { "type": "object" }
        }
      },
      "instructions": {
        "summary": "Create static IP reservation for a device",
        "when_to_use": [
          "User wants a device to always get the same IP",
          "Setting up static IP for a printer/server"
        ],
        "plain_english": "This makes the device always get the same address. Other devices won't be able to use this address."
      }
    },
    {
      "id": "mikrotik.dhcp.conflict_check",
      "name": "Check IP Conflicts",
      "description": "Detect IP address conflicts on the network where multiple devices claim the same address",
      "aeeIntent": "quox.noc.mikrotik.dhcp.conflicts.query",
      "aoclClassification": { "layer": 1, "risk": "LOW", "autonomy": "FULL" },
      "accessLevel": "specialists+",
      "defconLevel": "GREEN",
      "requiresApproval": false,
      "parameters": {
        "router_id": {
          "type": "string",
          "required": true,
          "description": "Router ID"
        }
      },
      "returns": {
        "type": "object",
        "properties": {
          "conflicts": { "type": "array" },
          "healthy": { "type": "boolean" },
          "plain_english": { "type": "string" }
        }
      },
      "instructions": {
        "summary": "Detect IP address conflicts",
        "when_to_use": [
          "User asks 'are there any IP conflicts?'",
          "Troubleshooting network connectivity issues"
        ],
        "plain_english": "Checks if any two devices are fighting over the same address"
      }
    },
    {
      "id": "mikrotik.dhcp.pool_status",